id,name,identifier,definition,image
4a9a8ee4-5774-401b-be5f-3d7656e76832,Abandoned,https://www.repostatus.org/#abandoned,"Initial development has started, but there has not yet been a stable, usable release; the project has been abandoned and the author(s) do not intend on continuing development.",
1c0af4bf-1e57-47a8-8400-493bbb392b48,Active,https://www.repostatus.org/#active,"The project has reached a stable, usable state and is being actively developed.",
b39e878a-351c-48a1-9d32-8c1d17dfa2be,Concept,https://www.repostatus.org/#concept,"Minimal or no implementation has been done yet, or the repository is only intended to be a limited example, demo, or proof-of-concept.",
16374fc7-3e84-4b6d-8c8e-9eeb177912f7,Inactive,https://www.repostatus.org/#inactive,"The project has reached a stable, usable state but is no longer being actively developed; support/maintenance will be provided as time allows.",
4189c417-a043-4a44-a2d5-d28e894e36f8,Moved,https://www.repostatus.org/#moved,"The project has been moved to a new location, and the version at that location should be considered authoritative.",
e5c18aaf-a04e-4a8e-ae7c-d694d2443dd4,Suspended,https://www.repostatus.org/#suspended,"Initial development has started, but there has not yet been a stable, usable release; work has been stopped for the time being but the author(s) intend on resuming work.",
95941668-30f3-4cd3-8747-da1d34e02a6c,Unsupported,https://www.repostatus.org/#unsupported,"The project has reached a stable, usable state but the author(s) have ceased all work on it. A new maintainer may be desired.",
440bd3af-1490-4142-af71-746e53521551,WIP,https://www.repostatus.org/#wip,"Initial development is in progress, but there has not yet been a stable, usable release suitable for the public.",
