id,name,identifier,definition,image
96c1779a-5a44-4bfc-a516-90f54ae11cbb,Abandoned,https://www.repostatus.org/#abandoned,"Initial development has started, but there has not yet been a stable, usable release; the project has been abandoned and the author(s) do not intend on continuing development.",
dd90a522-bbfa-4880-a5d3-a922bec2c6e1,Active,https://www.repostatus.org/#active,"The project has reached a stable, usable state and is being actively developed.",
5eb5ae37-1806-40f0-979e-62ce10e019f6,Concept,https://www.repostatus.org/#concept,"Minimal or no implementation has been done yet, or the repository is only intended to be a limited example, demo, or proof-of-concept.",
9e09370f-a288-4df4-a1cd-497d953567a1,Inactive,https://www.repostatus.org/#inactive,"The project has reached a stable, usable state but is no longer being actively developed; support/maintenance will be provided as time allows.",
0dc30bfc-4c50-4a89-9e7c-750b74bc731d,Moved,https://www.repostatus.org/#moved,"The project has been moved to a new location, and the version at that location should be considered authoritative.",
384bbcfa-9aea-4ab5-a3b4-680e2d27e353,Suspended,https://www.repostatus.org/#suspended,"Initial development has started, but there has not yet been a stable, usable release; work has been stopped for the time being but the author(s) intend on resuming work.",
f419549f-1aa3-48dc-9c04-40a554b05159,Unsupported,https://www.repostatus.org/#unsupported,"The project has reached a stable, usable state but the author(s) have ceased all work on it. A new maintainer may be desired.",
2cc454b5-f5f9-453a-b847-b5cd915e587a,WIP,https://www.repostatus.org/#wip,"Initial development is in progress, but there has not yet been a stable, usable release suitable for the public.",
